{
  "affectedPaths": [
    ".github/workflows/governance-full.yml",
    "control-plane/cli/governance-emit-ci.test.ts",
    "control-plane/cli/governance-emit-ci.ts",
    "control-plane/cli/governance-pr-body.test.ts",
    "control-plane/cli/governance-pr-body.ts",
    "control-plane/cli/pr-body-check.ts",
    "docs/runbooks/how-to-fix-evidence-drift.md",
    "docs/runbooks/how-to-repair-pr-body.md",
    "docs/runbooks/workflow-integrity.md",
    "package.json",
    "scripts/ci/verify-workflows.test.ts",
    "scripts/ci/verify-workflows.ts",
    "scripts/governance/emit-ci-parity.sh"
  ],
  "autonomyScopeExpanded": false,
  "determinismStatement": "Deterministic evidence generation from PR metadata using canonical JSON and stable ordering.",
  "mode": "autonomous",
  "retrySemanticsModified": false,
  "tier": 3
}
